### ISSUE TITLE
NAT not working under higher load

### ISSUE THREAD

**Issue by imp1sh** [containers/netavark#890]
Debian 12 netavark 1.4.0-3 podman 4.3.1+ds1-8+b1 aardvark 1.4.0-3

I experience issues with NAT not being done, in my case only for one source address. My traffic is 99% IPv6.
I run an rsyslog container. The syslog clients send the traffic to the podman host on port 514 UDP.
With tcpdump I see that the traffic hits the host and is then DNATed to the IP of the container 
```
16:15:56.208912 ens18 In  IP6 2001:4aaa:28d4:7300::10.47492 > 2001:4aaa:28d4:7300::1f.514: SYSLOG daemon.error, length: 121
16:15:56.208923 podman1 Out IP6 2001:4aaa:28d4:7300::10.47492 > fda9:92d6:18ac:e10e::4ce.514: SYSLOG daemon.error, length: 121
```
One syslog client is much more active than others as it's a firewall that sends all rejected/dropped packet logs to the rsyslog container. Those packets are not NATed thus never arriving at the container.
I'm not certain that it's due to the fact that the traffic from this source is higher but it's my best guess.
```
16:15:51.520750 ens18 In  IP6 2001:4aaa:28d4:7300::1.52900 > 2001:4aaa:28d4:7300::1f.514: SYSLOG kernel.warning, length: 294
16:15:51.850439 ens18 In  IP6 2001:4aaa:28d4:7300::1.52900 > 2001:4aaa:28d4:7300::1f.514: SYSLOG kernel.warning, length: 294
16:15:52.750655 ens18 In  IP6 2001:4aaa:28d4:7300::1.52900 > 2001:4aaa:28d4:7300::1f.514: SYSLOG kernel.warning, length: 294
16:15:52.750656 ens18 In  IP6 2001:4aaa:28d4:7300::1.52900 > 2001:4aaa:28d4:7300::1f.514: SYSLOG kernel.warning, length: 294
16:15:52.860613 ens18 In  IP6 2001:4aaa:28d4:7300::1.52900 > 2001:4aaa:28d4:7300::1f.514: SYSLOG kernel.warning, length: 294
16:15:52.860630 ens18 In  IP6 2001:4aaa:28d4:7300::1.52900 > 2001:4aaa:28d4:7300::1f.514: SYSLOG kernel.warning, length: 294
16:15:53.380422 ens18 In  IP6 2001:4aaa:28d4:7300::1.52900 > 2001:4aaa:28d4:7300::1f.514: SYSLOG kernel.warning, length: 294
16:15:54.200551 ens18 In  IP6 2001:4aaa:28d4:7300::1.52900 > 2001:4aaa:28d4:7300::1f.514: SYSLOG kernel.warning, length: 301
16:15:54.250611 ens18 In  IP6 2001:4aaa:28d4:7300::1.52900 > 2001:4aaa:28d4:7300::1f.514: SYSLOG kernel.warning, length: 294
16:15:54.260591 ens18 In  IP6 2001:4aaa:28d4:7300::1.52900 > 2001:4aaa:28d4:7300::1f.514: SYSLOG kernel.warning, length: 294
16:15:54.600579 ens18 In  IP6 2001:4aaa:28d4:7300::1.52900 > 2001:4aaa:28d4:7300::1f.514: SYSLOG kernel.warning, length: 294
16:15:54.600806 ens18 In  IP6 2001:4aaa:28d4:7300::1.52900 > 2001:4aaa:28d4:7300::1f.514: SYSLOG kernel.warning, length: 294
```

This is the network my guests use:
```json
[
     {
          "name": "podmannet",
          "id": "cbea01b7398ff5fdf95faf1a5275d62d0691f0821a7906f4dd36bfe054956b53",
          "driver": "bridge",
          "network_interface": "podman1",
          "created": "2023-11-01T23:35:21.231236772+01:00",
          "subnets": [
               {
                    "subnet": "10.89.0.0/24",
                    "gateway": "10.89.0.1"
               },
               {
                    "subnet": "fda9:92d6:18ac:e10e::/64",
                    "gateway": "fda9:92d6:18ac:e10e::1"
               }
          ],
          "ipv6_enabled": true,
          "internal": false,
          "dns_enabled": true,
          "ipam_options": {
               "driver": "host-local"
          }
     }
]
```
Here's an excerpt of the nft ruleset:
```
        chain NETAVARK-DN-AA6364D1A4EDD {
[...]
                ip6 saddr fda9:92d6:18ac:e10e::/64 tcp dport 514 counter packets 0 bytes 0 jump NETAVARK-HOSTPORT-SETMARK
                ip6 saddr ::1 tcp dport 514 counter packets 0 bytes 0 jump NETAVARK-HOSTPORT-SETMARK
                tcp dport 514 counter packets 0 bytes 0 
                ip6 saddr fda9:92d6:18ac:e10e::/64 udp dport 514 counter packets 0 bytes 0 jump NETAVARK-HOSTPORT-SETMARK
                ip6 saddr ::1 udp dport 514 counter packets 0 bytes 0 jump NETAVARK-HOSTPORT-SETMARK
                udp dport 514 counter packets 3073 bytes 509720 
        }
```

**Comment by mheon** [comment]
Can you provide the full `nat` table?

**Comment by imp1sh** [comment]
of course, here you go
```
        chain NETAVARK-DN-AA6364D1A4EDD {
                ip saddr 10.89.0.0/24 tcp dport 9200 counter packets 0 bytes 0 jump NETAVARK-HOSTPORT-SETMARK
                ip saddr 127.0.0.1 tcp dport 9200 counter packets 0 bytes 0 jump NETAVARK-HOSTPORT-SETMARK
                tcp dport 9200 counter packets 0 bytes 0 dnat to 10.89.0.2:9200
                ip saddr 10.89.0.0/24 ip daddr 10.10.129.39 tcp dport 53 counter packets 0 bytes 0 jump NETAVARK-HOSTPORT-SETMARK
                ip saddr 127.0.0.1 ip daddr 10.10.129.39 tcp dport 53 counter packets 0 bytes 0 jump NETAVARK-HOSTPORT-SETMARK
                ip daddr 10.10.129.39 tcp dport 53 counter packets 0 bytes 0 dnat to 10.89.0.3:53
                ip saddr 10.89.0.0/24 ip daddr 10.10.129.39 udp dport 53 counter packets 0 bytes 0 jump NETAVARK-HOSTPORT-SETMARK
                ip saddr 127.0.0.1 ip daddr 10.10.129.39 udp dport 53 counter packets 0 bytes 0 jump NETAVARK-HOSTPORT-SETMARK
                ip daddr 10.10.129.39 udp dport 53 counter packets 0 bytes 0 dnat to 10.89.0.3:53
                ip saddr 10.89.0.0/24 tcp dport 4000 counter packets 0 bytes 0 jump NETAVARK-HOSTPORT-SETMARK
                ip saddr 127.0.0.1 tcp dport 4000 counter packets 0 bytes 0 jump NETAVARK-HOSTPORT-SETMARK
                tcp dport 4000 counter packets 0 bytes 0 dnat to 10.89.0.3:4000
                ip saddr 10.89.0.0/24 tcp dport 3829 counter packets 0 bytes 0 jump NETAVARK-HOSTPORT-SETMARK
                ip saddr 127.0.0.1 tcp dport 3829 counter packets 0 bytes 0 jump NETAVARK-HOSTPORT-SETMARK
                tcp dport 3829 counter packets 178 bytes 10680 dnat to 10.89.0.5:80
                ip saddr 10.89.0.0/24 tcp dport 8082 counter packets 0 bytes 0 jump NETAVARK-HOSTPORT-SETMARK
                ip saddr 127.0.0.1 tcp dport 8082 counter packets 0 bytes 0 jump NETAVARK-HOSTPORT-SETMARK
                tcp dport 8082 counter packets 1449 bytes 86940 dnat to 10.89.0.5:8082
                ip saddr 10.89.0.0/24 tcp dport 3000 counter packets 0 bytes 0 jump NETAVARK-HOSTPORT-SETMARK
                ip saddr 127.0.0.1 tcp dport 3000 counter packets 0 bytes 0 jump NETAVARK-HOSTPORT-SETMARK
                tcp dport 3000 counter packets 2126 bytes 127560 dnat to 10.89.0.6:3000
                ip saddr 10.89.0.0/24 tcp dport 3003 counter packets 0 bytes 0 jump NETAVARK-HOSTPORT-SETMARK
                ip saddr 127.0.0.1 tcp dport 3003 counter packets 0 bytes 0 jump NETAVARK-HOSTPORT-SETMARK
                tcp dport 3003 counter packets 0 bytes 0 dnat to 10.89.0.7:3000
                ip saddr 10.89.0.0/24 tcp dport 3002 counter packets 0 bytes 0 jump NETAVARK-HOSTPORT-SETMARK
                ip saddr 127.0.0.1 tcp dport 3002 counter packets 0 bytes 0 jump NETAVARK-HOSTPORT-SETMARK
                tcp dport 3002 counter packets 5 bytes 300 dnat to 10.89.0.8:3000
                ip saddr 10.89.0.0/24 tcp dport 3004 counter packets 0 bytes 0 jump NETAVARK-HOSTPORT-SETMARK
                ip saddr 127.0.0.1 tcp dport 3004 counter packets 0 bytes 0 jump NETAVARK-HOSTPORT-SETMARK
                tcp dport 3004 counter packets 0 bytes 0 dnat to 10.89.0.9:3000
                ip saddr 10.89.0.0/24 tcp dport 3005 counter packets 0 bytes 0 jump NETAVARK-HOSTPORT-SETMARK
                ip saddr 127.0.0.1 tcp dport 3005 counter packets 0 bytes 0 jump NETAVARK-HOSTPORT-SETMARK
                tcp dport 3005 counter packets 2081 bytes 124860 dnat to 10.89.0.10:3000
                ip saddr 10.89.0.0/24 tcp dport 8415 counter packets 0 bytes 0 jump NETAVARK-HOSTPORT-SETMARK
                ip saddr 127.0.0.1 tcp dport 8415 counter packets 0 bytes 0 jump NETAVARK-HOSTPORT-SETMARK
                tcp dport 8415 counter packets 1 bytes 60 dnat to 10.89.0.11:8069
                ip saddr 10.89.0.0/24 tcp dport 8000 counter packets 0 bytes 0 jump NETAVARK-HOSTPORT-SETMARK
                ip saddr 127.0.0.1 tcp dport 8000 counter packets 0 bytes 0 jump NETAVARK-HOSTPORT-SETMARK
                tcp dport 8000 counter packets 0 bytes 0 dnat to 10.89.0.12:8000
                ip saddr 10.89.0.0/24 tcp dport 3842 counter packets 0 bytes 0 jump NETAVARK-HOSTPORT-SETMARK
                ip saddr 127.0.0.1 tcp dport 3842 counter packets 0 bytes 0 jump NETAVARK-HOSTPORT-SETMARK
                tcp dport 3842 counter packets 0 bytes 0 dnat to 10.89.0.14:80
                ip saddr 10.89.0.0/24 tcp dport 25566 counter packets 0 bytes 0 jump NETAVARK-HOSTPORT-SETMARK
                ip saddr 127.0.0.1 tcp dport 25566 counter packets 0 bytes 0 jump NETAVARK-HOSTPORT-SETMARK
                tcp dport 25566 counter packets 0 bytes 0 dnat to 10.89.0.15:25565
                ip saddr 10.89.0.0/24 tcp dport 8520 counter packets 0 bytes 0 jump NETAVARK-HOSTPORT-SETMARK
                ip saddr 127.0.0.1 tcp dport 8520 counter packets 0 bytes 0 jump NETAVARK-HOSTPORT-SETMARK
                tcp dport 8520 counter packets 0 bytes 0 dnat to 10.89.0.18:8000
                ip saddr 10.89.0.0/24 tcp dport 3100 counter packets 0 bytes 0 jump NETAVARK-HOSTPORT-SETMARK
                ip saddr 127.0.0.1 tcp dport 3100 counter packets 2 bytes 120 jump NETAVARK-HOSTPORT-SETMARK
                tcp dport 3100 counter packets 2 bytes 120 dnat to 10.89.0.19:3100
                ip saddr 10.89.0.0/24 tcp dport 8147 counter packets 0 bytes 0 jump NETAVARK-HOSTPORT-SETMARK
                ip saddr 127.0.0.1 tcp dport 8147 counter packets 0 bytes 0 jump NETAVARK-HOSTPORT-SETMARK
                tcp dport 8147 counter packets 0 bytes 0 dnat to 10.89.0.20:3000
                ip saddr 10.89.0.0/24 tcp dport 8416 counter packets 0 bytes 0 jump NETAVARK-HOSTPORT-SETMARK
                ip saddr 127.0.0.1 tcp dport 8416 counter packets 0 bytes 0 jump NETAVARK-HOSTPORT-SETMARK
                tcp dport 8416 counter packets 0 bytes 0 dnat to 10.89.0.21:9090
                ip saddr 10.89.0.0/24 tcp dport 8985 counter packets 0 bytes 0 jump NETAVARK-HOSTPORT-SETMARK
                ip saddr 127.0.0.1 tcp dport 8985 counter packets 0 bytes 0 jump NETAVARK-HOSTPORT-SETMARK
                tcp dport 8985 counter packets 0 bytes 0 dnat to 10.89.0.22:8080
                ip saddr 10.89.0.0/24 tcp dport 8083 counter packets 0 bytes 0 jump NETAVARK-HOSTPORT-SETMARK
                ip saddr 127.0.0.1 tcp dport 8083 counter packets 0 bytes 0 jump NETAVARK-HOSTPORT-SETMARK
                tcp dport 8083 counter packets 0 bytes 0 dnat to 10.89.0.23:8083
                ip saddr 10.89.0.0/24 tcp dport 8001 counter packets 0 bytes 0 jump NETAVARK-HOSTPORT-SETMARK
                ip saddr 127.0.0.1 tcp dport 8001 counter packets 0 bytes 0 jump NETAVARK-HOSTPORT-SETMARK
                tcp dport 8001 counter packets 0 bytes 0 dnat to 10.89.0.24:8080
                ip saddr 10.89.0.0/24 tcp dport 9641 counter packets 0 bytes 0 jump NETAVARK-HOSTPORT-SETMARK
                ip saddr 127.0.0.1 tcp dport 9641 counter packets 0 bytes 0 jump NETAVARK-HOSTPORT-SETMARK
                tcp dport 9641 counter packets 0 bytes 0 dnat to 10.89.0.25:9641
                ip saddr 10.89.0.0/24 tcp dport 1883 counter packets 0 bytes 0 jump NETAVARK-HOSTPORT-SETMARK
                ip saddr 127.0.0.1 tcp dport 1883 counter packets 0 bytes 0 jump NETAVARK-HOSTPORT-SETMARK
                tcp dport 1883 counter packets 5 bytes 284 dnat to 10.89.0.26:1883
                ip saddr 10.89.0.0/24 tcp dport 9001 counter packets 0 bytes 0 jump NETAVARK-HOSTPORT-SETMARK
                ip saddr 127.0.0.1 tcp dport 9001 counter packets 0 bytes 0 jump NETAVARK-HOSTPORT-SETMARK
                tcp dport 9001 counter packets 0 bytes 0 dnat to 10.89.0.26:9001
                ip saddr 10.89.0.0/24 tcp dport 8984 counter packets 0 bytes 0 jump NETAVARK-HOSTPORT-SETMARK
                ip saddr 127.0.0.1 tcp dport 8984 counter packets 0 bytes 0 jump NETAVARK-HOSTPORT-SETMARK
                tcp dport 8984 counter packets 0 bytes 0 dnat to 10.89.0.27:8008
                ip saddr 10.89.0.0/24 tcp dport 8136 counter packets 0 bytes 0 jump NETAVARK-HOSTPORT-SETMARK
                ip saddr 127.0.0.1 tcp dport 8136 counter packets 0 bytes 0 jump NETAVARK-HOSTPORT-SETMARK
                tcp dport 8136 counter packets 0 bytes 0 dnat to 10.89.0.28:8082
                ip saddr 10.89.0.0/24 tcp dport 8135 counter packets 0 bytes 0 jump NETAVARK-HOSTPORT-SETMARK
                ip saddr 127.0.0.1 tcp dport 8135 counter packets 0 bytes 0 jump NETAVARK-HOSTPORT-SETMARK
                tcp dport 8135 counter packets 0 bytes 0 dnat to 10.89.0.30:88
                ip saddr 10.89.0.0/24 tcp dport 8134 counter packets 0 bytes 0 jump NETAVARK-HOSTPORT-SETMARK
                ip saddr 127.0.0.1 tcp dport 8134 counter packets 0 bytes 0 jump NETAVARK-HOSTPORT-SETMARK
                tcp dport 8134 counter packets 0 bytes 0 dnat to 10.89.0.31:8083
                ip saddr 10.89.0.0/24 tcp dport 4323 counter packets 0 bytes 0 jump NETAVARK-HOSTPORT-SETMARK
                ip saddr 127.0.0.1 tcp dport 4323 counter packets 0 bytes 0 jump NETAVARK-HOSTPORT-SETMARK
                tcp dport 4323 counter packets 0 bytes 0 dnat to 10.89.0.33:80
                ip saddr 10.89.0.0/24 tcp dport 8983 counter packets 0 bytes 0 jump NETAVARK-HOSTPORT-SETMARK
                ip saddr 127.0.0.1 tcp dport 8983 counter packets 0 bytes 0 jump NETAVARK-HOSTPORT-SETMARK
                tcp dport 8983 counter packets 0 bytes 0 dnat to 10.89.0.34:8983
                ip saddr 10.89.0.0/24 tcp dport 8982 counter packets 0 bytes 0 jump NETAVARK-HOSTPORT-SETMARK
                ip saddr 127.0.0.1 tcp dport 8982 counter packets 0 bytes 0 jump NETAVARK-HOSTPORT-SETMARK
                tcp dport 8982 counter packets 0 bytes 0 dnat to 10.89.0.35:8982
                ip saddr 10.89.0.0/24 tcp dport 8980 counter packets 0 bytes 0 jump NETAVARK-HOSTPORT-SETMARK
                ip saddr 127.0.0.1 tcp dport 8980 counter packets 0 bytes 0 jump NETAVARK-HOSTPORT-SETMARK
                tcp dport 8980 counter packets 0 bytes 0 dnat to 10.89.0.36:8980
                ip saddr 10.89.0.0/24 tcp dport 7106 counter packets 0 bytes 0 jump NETAVARK-HOSTPORT-SETMARK
                ip saddr 127.0.0.1 tcp dport 7106 counter packets 0 bytes 0 jump NETAVARK-HOSTPORT-SETMARK
                tcp dport 7106 counter packets 0 bytes 0 dnat to 10.89.0.37:8081
                ip saddr 10.89.0.0/24 tcp dport 7104 counter packets 0 bytes 0 jump NETAVARK-HOSTPORT-SETMARK
                ip saddr 127.0.0.1 tcp dport 7104 counter packets 0 bytes 0 jump NETAVARK-HOSTPORT-SETMARK
                tcp dport 7104 counter packets 0 bytes 0 dnat to 10.89.0.39:8080
                ip saddr 10.89.0.0/24 tcp dport 7101 counter packets 0 bytes 0 jump NETAVARK-HOSTPORT-SETMARK
                ip saddr 127.0.0.1 tcp dport 7101 counter packets 0 bytes 0 jump NETAVARK-HOSTPORT-SETMARK
                tcp dport 7101 counter packets 0 bytes 0 dnat to 10.89.0.40:8080
                ip saddr 10.89.0.0/24 tcp dport 7102 counter packets 0 bytes 0 jump NETAVARK-HOSTPORT-SETMARK
                ip saddr 127.0.0.1 tcp dport 7102 counter packets 0 bytes 0 jump NETAVARK-HOSTPORT-SETMARK
                tcp dport 7102 counter packets 0 bytes 0 dnat to 10.89.0.41:8080
                ip saddr 10.89.0.0/24 tcp dport 9188 counter packets 0 bytes 0 jump NETAVARK-HOSTPORT-SETMARK
                ip saddr 127.0.0.1 tcp dport 9188 counter packets 0 bytes 0 jump NETAVARK-HOSTPORT-SETMARK
                tcp dport 9188 counter packets 0 bytes 0 dnat to 10.89.0.42:9187
                ip saddr 10.89.0.0/24 tcp dport 9527 counter packets 0 bytes 0 jump NETAVARK-HOSTPORT-SETMARK
                ip saddr 127.0.0.1 tcp dport 9527 counter packets 0 bytes 0 jump NETAVARK-HOSTPORT-SETMARK
                tcp dport 9527 counter packets 0 bytes 0 dnat to 10.89.0.43:3000
                ip saddr 10.89.0.0/24 tcp dport 9081 counter packets 0 bytes 0 jump NETAVARK-HOSTPORT-SETMARK
                ip saddr 127.0.0.1 tcp dport 9081 counter packets 0 bytes 0 jump NETAVARK-HOSTPORT-SETMARK
                tcp dport 9081 counter packets 0 bytes 0 dnat to 10.89.0.44:9081
                ip saddr 10.89.0.0/24 tcp dport 514 counter packets 0 bytes 0 jump NETAVARK-HOSTPORT-SETMARK
                ip saddr 127.0.0.1 tcp dport 514 counter packets 0 bytes 0 jump NETAVARK-HOSTPORT-SETMARK
                tcp dport 514 counter packets 0 bytes 0 dnat to 10.89.0.45:514
                ip saddr 10.89.0.0/24 udp dport 514 counter packets 0 bytes 0 jump NETAVARK-HOSTPORT-SETMARK
                ip saddr 127.0.0.1 udp dport 514 counter packets 0 bytes 0 jump NETAVARK-HOSTPORT-SETMARK
                udp dport 514 counter packets 0 bytes 0 dnat to 10.89.0.45:514
                ip saddr 10.89.0.0/24 tcp dport 7105 counter packets 0 bytes 0 jump NETAVARK-HOSTPORT-SETMARK
                ip saddr 127.0.0.1 tcp dport 7105 counter packets 0 bytes 0 jump NETAVARK-HOSTPORT-SETMARK
                tcp dport 7105 counter packets 0 bytes 0 dnat to 10.89.0.48:8080
                ip saddr 10.89.0.0/24 tcp dport 8096 counter packets 0 bytes 0 jump NETAVARK-HOSTPORT-SETMARK
                ip saddr 127.0.0.1 tcp dport 8096 counter packets 0 bytes 0 jump NETAVARK-HOSTPORT-SETMARK
                tcp dport 8096 counter packets 0 bytes 0 dnat to 10.89.0.49:8096
                ip saddr 10.89.0.0/24 tcp dport 8111 counter packets 0 bytes 0 jump NETAVARK-HOSTPORT-SETMARK
                ip saddr 127.0.0.1 tcp dport 8111 counter packets 0 bytes 0 jump NETAVARK-HOSTPORT-SETMARK
                tcp dport 8111 counter packets 0 bytes 0 dnat to 10.89.0.50:8080
                ip saddr 10.89.0.0/24 tcp dport 7070 counter packets 0 bytes 0 jump NETAVARK-HOSTPORT-SETMARK
                ip saddr 127.0.0.1 tcp dport 7070 counter packets 0 bytes 0 jump NETAVARK-HOSTPORT-SETMARK
                tcp dport 7070 counter packets 0 bytes 0 dnat to 10.89.0.63:7070
                ip saddr 10.89.0.0/24 tcp dport 8887 counter packets 0 bytes 0 jump NETAVARK-HOSTPORT-SETMARK
                ip saddr 127.0.0.1 tcp dport 8887 counter packets 0 bytes 0 jump NETAVARK-HOSTPORT-SETMARK
                tcp dport 8887 counter packets 0 bytes 0 dnat to 10.89.0.63:8887
                ip saddr 10.89.0.0/24 udp dport 7090 counter packets 0 bytes 0 jump NETAVARK-HOSTPORT-SETMARK
                ip saddr 127.0.0.1 udp dport 7090 counter packets 0 bytes 0 jump NETAVARK-HOSTPORT-SETMARK
                udp dport 7090 counter packets 0 bytes 0 dnat to 10.89.0.63:7090
                ip saddr 10.89.0.0/24 udp dport 9522 counter packets 0 bytes 0 jump NETAVARK-HOSTPORT-SETMARK
                ip saddr 127.0.0.1 udp dport 9522 counter packets 0 bytes 0 jump NETAVARK-HOSTPORT-SETMARK
                udp dport 9522 counter packets 0 bytes 0 dnat to 10.89.0.63:9522
        }
```
