### ISSUE TITLE
The DNS resolution in container has different behavior with and without "--dns" added in "podman run" command, even the /etc/resolv.conf have the same content in container

### ISSUE THREAD

**Issue by 839735495** [containers/netavark#855]
**ENV**
[Rootful]
aardvark-dns-1.5.0-2.module+el8.8.0+19993+47c8ef84.x86_64
netavark-1.5.1-2.module+el8.8.0+19993+47c8ef84.x86_64
networkBackend is netavark
OS: RHEL 8.8

**What is the issue**
The DNS resolution in container has different behavior with and without "--dns" added in "podman run" command, even the /etc/resolv.conf have the same content in container.

**How to reproduce**
1. Create dual stack network using command:
`podman network create --driver=bridge --subnet=192.168.230.0/25 --ipv6 --subnet=fdf8:192:168:230::/121 foo`

2. Execute command to run two container:
`podman run -d -it --dns=192.168.230.1 --dns=fdf8:192:168:230::1 --dns=${my_dns} --name foo_1 --network foo ${my_image}`
`podman  run -d -it --name foo_2 --network foo ${my_image}`

3. My iptables and ip6tables rule:
```
# iptables -nvL INPUT
Chain INPUT (policy ACCEPT 923K packets, 113M bytes)
 pkts bytes target     prot opt in     out     source               destination
   46  3438 ACCEPT     udp  --  *      *       0.0.0.0/0            192.168.230.1        udp dpt:53
   34  4436 REJECT     all  --  *      *       0.0.0.0/0            192.168.230.0/25     reject-with icmp-port-unreachable

# ip6tables -nvL INPUT
Chain INPUT (policy ACCEPT 533K packets, 64M bytes)
 pkts bytes target     prot opt in     out     source               destination
   18  1728 ACCEPT     udp      *      *       ::/0                 fdf8:192:168:230::1  udp dpt:53
   36  5316 REJECT     all      *      *       ::/0                 fdf8:192:168:230::/121  reject-with icmp6-port-unreachable
```

4. /etc/resolv.conf in foo_1 and foo_2 (same)
```
[root@05e297721834 /]# cat /etc/resolv.conf
search dns.podman [my_search_domain]
nameserver 192.168.230.1
nameserver fdf8:192:168:230::1
nameserver [my_dns]
```

5. In foo_1, DNS resolution very slow(8+ seconds). In foo_2, DNS resolution normal speed(1- seconds)
```
# podman exec -it foo_1 bash
[root@05e297721834 /]# time getent ahosts ${outside_hostname}
10.188.186.222  STREAM ${outside_hostname}.${my_search_domain}
10.188.186.222  DGRAM
10.188.186.222  RAW

real    **0m8.201s**
user    0m0.000s
sys     0m0.003s
[root@05e297721834 /]# exit
exit
# podman exec -it foo_2 bash
[root@a1f7f6d70e0f /]# time getent ahosts ${outside_hostname}
10.188.186.222  STREAM ${outside_hostname}.${my_search_domain}
10.188.186.222  DGRAM
10.188.186.222  RAW

real    0m0.196s
user    0m0.000s
sys     0m0.003s
```

**RCA**
Why in foo_1 is very slow.
Here is the part of tcpdump details when running getent in foo_1:
```
07:32:00.980500 IP 192.168.230.88.59859 > 192.168.230.1.domain: 21298+ A? net186-host222.${my_search_domain}. (48)
07:32:00.980539 IP 192.168.230.88.59859 > 192.168.230.1.domain: 15373+ AAAA? net186-host222.${my_search_domain}. (48)
07:32:05.985236 IP6 fdf8:192:168:230::58.39687 > fdf8:192:168:230::1.domain: 21298+ A? net186-host222.${my_search_domain}. (48)
07:32:05.985287 IP6 fdf8:192:168:230::58.39687 > fdf8:192:168:230::1.domain: 15373+ AAAA? net186-host222.${my_search_domain}. (48)
**07:32:08.988425 IP 192.168.230.88.42389 > 172.16.8.12.domain: 21298+ A? net186-host222.${my_search_domain}. (48)
07:32:08.988548 IP 192.168.230.88.42389 > 172.16.8.12.domain: 15373+ AAAA? net186-host222.${my_search_domain}. (48)
07:32:09.181097 IP 172.16.8.12.domain > 192.168.230.88.42389: 21298* 1/0/0 A 10.188.186.222 (64)
07:32:09.181449 IP 172.16.8.12.domain > 192.168.230.88.42389: 15373* 0/1/0 (108)**
07:32:11.176015 IP 192.168.230.1.domain > 192.168.230.88.59859: 21298* 1/0/0 A 10.188.186.222 (64)
**07:32:11.176063 IP 192.168.230.88 > 192.168.230.1: ICMP 192.168.230.88 udp port 59859 unreachable, length 100**
07:32:11.026209 IP6 fe80::4c6e:36ff:fe0b:5880 > fdf8:192:168:230::1: ICMP6, neighbor solicitation, who has fdf8:192:168:230::1, length 32
**07:32:11.026262 IP6 fdf8:192:168:230::1 > fe80::4c6e:36ff:fe0b:5880: ICMP6, destination unreachable, unreachable port [|icmp6]**
```
The DNS response blocked by the 2nd iptable/ip6table rule in INPUT chain and finally got result from my custom DNS

However, in foo_2, it was not blocked, it returned very fast:
```
07:36:41.221171 IP 192.168.230.89.34653 > 192.168.230.1.domain: 35145+ A? net186-host222.${my_search_domain}. (48)
07:36:41.221223 IP 192.168.230.89.34653 > 192.168.230.1.domain: 48714+ AAAA? net186-host222.${my_search_domain}. (48)
07:36:41.413830 IP 192.168.230.1.domain > 192.168.230.89.34653: 35145* 1/0/0 A 10.188.186.222 (64)
07:36:41.413909 IP 192.168.230.1.domain > 192.168.230.89.34653: 48714* 0/1/0 (108)
```

**Question**
What is the different behavior using --dns and without --dns when running "podman run"? Why in foo_2 the dns response not blocked by the iptables rule?

**Comment by xiaoyar** [comment]
Thank you @Luap99 for your prompt response.
> Ignoring our own listening ips sounds like a reasonable suggestion. Alternative would be to error out because we should not allow user to end up in a infinite recursion.

Shall I open an `aardvark-dns` ticket to address this?

**Comment by Luap99** [comment]
Yes please

**Comment by xiaoyar** [comment]
Sure, https://github.com/containers/aardvark-dns/issues/415 is filed.

**Comment by Luap99** [comment]
> It seems the name servers in host's /etc/resolv.conf should not be populated in container's /etc/resolv.conf when the container is connected to a network with dns_enabled is true.

That is already the case with the latest version.
